PID,Social Media Post,Normalized Claim
2014,"as far as we are aware, there have been no published clinical trials of sodium bicarbonate as a treatment for cancer",sodium bicarbonate is a lethal poison to all cancers.
2015,tonight from 11 40pm nobody should be on the street. doors and windows should remain closed as 5 helicopters spray disinfectants into the air to eradicate the coronavirus. please process this information to all of your contacts,five helicopters are going to spray the air with disinfectant overnight in order to combat the new coronavirus
2016,embassy statement,"""the russian army does not occupy ukrainian territory."""
2017,"in the usa 387,087 reports of adverse events of this evil shot in the arm 6,113 deaths 31,240 serious injuries between december 14, 2020 and june 18, 2021","in the usa there have been 387,087 reports of adverse events after the covid 19 vaccination."
2019,"there has been no central audit of translation services in the national health service, as these services are commissioned by individual nhs organisations",the nhs spends 100 million on translators for 128 languages in five years.
2020,"only in india! christiano ronaldo fans in kerala have beaten up a hindu supremacist after he tore up the national flag of portugal, confusing it as the flag of the social democratic party of india.","only in india! cristiano ronaldo fans in kerala have beaten up a hindu supremacist after he tore up the national flag of portugal, confusing it as the flag of the social democratic party of india. fifaworldcup2022"
2021,"barath ratna sachin tendulkar along his family meet to modiji. he gives assured to modiji.tendulker support to bjp, modi ji. dear brother namaskar to all indian people please vote for bjp vote for modi ji barath mathaki jai vandemataram",former cricketer sachin tendulkar along with his wife met narendra modi to show his support for bjp in the general elections 2019.
2022,my plan is to thank president biden for giving americans the cheapest gas prices on earth. i gassed up today for 4.29 a gallon at exxon. thanks joe.,biden gave americans the cheapest gas prices on earth.
2023,pause... let the cameraman come....,pause... let the cameraman come....
2024,"this is so confusing... not over 94 of people who got the first two doses have covid! wait...so that means covid affects the vaccinated 94 more than the unvaccinated??? how is this still even a conversation? not to mention, victoria was locked down for months because of five cases last year!!!",more than 94 per cent of victorians who received two vaccine doses now have covid 19.
2025,"read chad booc? he is no hero volunteer for the indigenous people of mindanao. booc is in fact deployed purposely and deliberately as a full time cpp cadre operative to do 'legal institution' work for the cpp npa ndf in the misfi alternative lumad or ip schools, in order to unify and implement the cpp npa ndf program of expansion, recovery and consolidation among various ip communities in mindanao. booc has consistently been an underground recruiter and operator for the cpp npa ndf even during his student days in up diliman, where he was part of the cpp party branch unit in college of engineering. his operations included recruitment of young students, some are minors to become part of the cpp and ndf affiliated organization for the youth and students which supports the armed and terroristic activities of the cpp npa ndf the organization of kabataang makabayan or km. booc continues with his nefarious and terroristic activities in mindanao, by being part of the core cadre operatives of the cpp npa ndf who were deployed to provide directional leadership to cpp created so called misfi institution, where the cpp npa ndf fund raising, resource generation, recruitment for the npa, among other activities, have been concealed through their so called 'alternative lumad schools project,' like alcadev, salugpungan, etc.. clearly, chad booc is the embodiment of the operational doctrine of the cpp npa ndf, known as 'revolutionary dual tactics', where they are able to circumvent and exploit our laws and legal system, to their advantage, just like the duplicitous and deceptive schemes of mafia like operations of cpp partylists, led by zarate, elago, et al. this dubious cpp npa ndf operative chad booc must be exposed to the public, so that their evil deeds against the ips in mindanao, especially against the ip youth and children, must be put to a stop, and the bar of justice shall bear upon them. sambayanan february 17, 2021",the up college of engineering up coe is housing a branch of the communist party of the philippines cpp .
2026,portable roads of india,image of a damaged road in india
2027,"voter id is supported by an overwhelming majority of nyers, from all across the state, walks of life, political parties. i am calling on gov. kathy hochul the nys legislature to enact a law in ny requiring id to be presented whenever a person shows up to vote.","voter id is supported by an overwhelming majority of nyers, from all across the state, walks of life, political parties."
2028,this kills coronavirus how did they know about it in 2019??,dettol kills coronavirus
2029,i am at the nuclear power plant. i am at the olympic ski jump. i am at the combination nuclear power plant olympic ski jump.,2022 olympians are competing next to a nuclear power plant
2030,1 cr 54 lakhs for this?,"recently, kanimozhi and geetha jeevan inaugurated a bus stop in thoothukudi. the cost mentioned is rs.1.54 crore. do this tin roof and stainless steel rod costs one crore and 54 lakhs?"
2031,as if it could not get any worse. says causes solution... rip cancer patients teeth out. monsters,having a root canal can cause cancer
2032,"america is 33rd in access to quality education, 33rd in child mortality and 31st in clean drinking water. but our stock market is up.","west virginia is near last in the you.s. rankings of education, clean drinking water, and child mortality."
2033,"thanks to for having me to discuss the need for truth in political advertising and the stop the lies bill i will introduce next month. the standards of advertising for political parties is non existent, and this needs to change","""it is perfectly legal to lie in a political ad."""
2034,"among countries with more than 1 lakh cases, india has the second fastest doubling rate. please tell your ministers to not fool people into a false sense of security dear pm . please.",india has the second fastest doubling rate among the countries with the highest number of covid 19 cases
2036,"what a coincidence, they are using their existing app to drag people back into dressed up communism, a future planned for all of us if we do not fight","ukraine just announced it is the first country to implement the wef's great reset by setting up a social credit application combining universal basic income ubi , a digital identity and a vaccine passport all within the diia app."
2037,there are claims circulating that incorrectly state that the red cross will not accept convalescent plasma donations from those who have received the covid 19 vaccine.,the red cross says people vaccinated against covid 19 cannot donate blood plasma because the vaccine wipes out antibodies.
2038,"the aftermath of glastonbury festival, where they all cheered in support of greta thunberg, who was flown in to lecture on saving the planet","image shows aftermath of glastonbury festival, where greta thunberg gave a lecture on saving the planet."
2040,argentina government has decided to give holiday to entire nation between november 15 to december 25 for fifa world cup 2022. this was sic never happened before in the history of argentina. this world cup is going to be something special,the argentine government is giving the entire nation a public holiday for the duration of the 2022 world cup.
2041,wow check this out.. crowd singing song for in,wow check this out.. crowd singing song for palestinians in fifaworldcup2022 qatar
2042,just in bcci officially suspends ipl 2020 indefinitely in light of the pandemic.,just in bcci officially suspends ipl 2020 indefinitely in the wake of coronavirus pandemic.
2043,i agree with you but show what you are talking about specifically or it just more noise.,the uk government now admits that vaccines have damaged the natural immune system of those who have been double vaccinated.
2047,incredible india ! i finally encountered the most beautiful water highway,incredible india. i found the most beautiful water highway in india.
2049,where are you.. see after cremating congress in gujarat hardik patel ready to launch new cd,where are you.. see after cremating congress in gujarat hardik patel ready to launch new cd
2052,rebel shiv sena leader shinde. was drunk on power or just drunk?,rebel shiv sena leader shinde. was drunk on power or just drunk?
2053,4 km long rack train with 4 engines being run on war footing basis to supply coal to power plants. this is ji's !,4 km long rack train with 4 engines being run on war footing basis to supply coal to power plants. this is modigov narendra modi ji s newindia !
2054,refers to activities to identify local covid 19 outbreaks and support local responses to the pandemic,37 billion was found to pay serco for a failed track and trace system.
2055,"the type of compounds we discovered are unique in their structure. and, because they are extremely oxidizing, they most likely bring a host of effects that we have yet to uncover","a new, potentially harmful, chemical found in the atmosphere is linked to chemtrails ."
2057,"so yes, we do see actors pretending to be covid patients but this is not staged for media purposes. on the contrary it is being used to help real doctors and nurses prepare for worst case scenarios",an actor was hired to pretend that she had been hospitalised with covid 19.
2058,"the humanitarian community launched a 333 million flash appeal to assist 1.6 million people affected by cyclone mocha. the health cluster, led by who, works with partners to support the recovery of health services to the affected population in cyclone affected areas. links below",1. myth garlic can help prevent the disease
2059,covid breakthrough as 'wonder' statins cut risk of death,taking statins cuts the risk of dying of covid 19.
2060,this is new india .,this is new india
2061,"how many messes have been done friends, it is surprising this is jumma pali mosque located in ramanathapuram district of tamil nadu, which is known for its beauty. looking at its interior, do not you think that this building must have once been a temple, which was later converted into a mosque? best regards.","friends are very surprised how many messes are being made this is the jumma pali mosque located in the ramanathapuram district of tamil nadu, which is known for its beauty. seeing its internal structure, do not you think that this building must have been a temple, which was later given the form of a mosque?"
2062,"due to having a few small dents and scratches we have been unable to sell this in our showroom, rather than flog it as second hand we have decided to bring some joy by giving it to someone who has sharred sic then commented by jan 11th at 5pm. delivery should be within 2 weeks",social media users could win a motorhome in exchange for sharing and liking a facebook post.
2064,got milk?,"raw cow s milk contains the lactase enzyme, making it easily digestible."
2069,"just had 5 years worth of rain, led by a fierce intense , last sunday. we are in a it is not just a fact but a reality we are facing, right now.",visuals related to cyclone shaheen
2071,"the decade 2007 17 saw almost 6.5 million new migrant gp registrations. the lancet medical journal reported 2016 that, ""english primary care as currently delivered could be reaching saturation point."" the correlation is clear. this level of immigration is unsustainable",the lancet says 6.5 million migrants have registered with gps in the last 10 years.
2072,"just for clarification, scotland does not receive any money from england. we get a part of the money we give england, back",scotland does not receive any money from england but instead receives part of its contribution back.
2074,"car rentals 87.7 gas prices 45.1 hotel prices 16.9 reckless spending is costing americans more this summer. instead of fixing inflation, the democrats plan on spending more.","says spending by democrats is driving major jumps in car rentals, gas prices and hotel prices this summer"
2075,"i am convinced that the only time government says anything that is true, it is an accident.",food prices have gone up 7 and egg prices have gone up 700
2076,"without a shred of clinical data to support its decision, the biden administration has revoked the emergency use authorization for lifesaving monoclonal antibody treatments.","without a shred of clinical data to support its decision, the biden administration has revoked the emergency use authorization for lifesaving monoclonal antibody treatments."
2077,"attention all citizens, the central government has announced a provision of 1.5 lakh rupees for every covid positive patient to the municipal corporation and municipality. due to this, the municipal corporation, municipality, private doctors, and testing labs collaborate to increase the number of positive cases as much as possible. therefore, when someone experiences symptoms like cold, cough, fever, etc., they forcefully admit them as positive. as soon as they receive approval for 1.5 lakh rupees, they declare the patient as recovered and send them back home. the only solution to end this conspiracy is to avoid going to doctors or testing labs. if you have symptoms like cold, cough, or fever, treat them with home remedies at home. do not become a victim of these fraudsters. wake up yourself and awaken others. help each other. i am posting this message only to alert all of you. if you find it appropriate, please keep forwarding it so that people become vigilant, and this information reaches the government, putting an end to this situation. if anything wrong has happened to anyone, please work to raise awareness among people in your vicinity, neighborhoods, and every street. do not be afraid, confront it with courage. these people are exploiting the common public and businessmen for their personal gains. by creating an atmosphere of fear, they are harassing businessmen. therefore, i also request businessmen that instead of pulling each other down in such times, help one another and raise your voice against this conspiracy. thank you. jai hind jai bharat. a vigilant citizen.",government of india providing rupees 1.5 lakh per covid 19 patient to every municipality
2078,"the fish is gone now crocodile location kuduvancheri chennai ""cm sir watch and investigate""",crocodile in rainwater in guduvanchery.
2080,action reaction up police,action reaction up police
2082,it is an incident from chennai.,people fell into a drain in chennai after the top concret floor broke
2083,this daughter has been found in bareilly on the train coming from mumbai. her name is sonal pate. plz share further whoever has it. pray too. do good. maybe you will help her reunite with her family,this daughter has been found in bareilly on the train coming from mumbai. her name is sonal pate. plz share further whoever has it. pray too. do good. maybe you will help her reunite with her family.
2088,there was no difference in scarlet fever or invasive group a strep igas notifications,the live flu vaccine has been found to cause strep a.
2089,how much more proof do you want that tests are a massive part of the problem,a bmj article is proof that the use of pcr tests are a massive part of the problem.
2090,president joe biden admits to faking the election,president joe biden admits to faking the election.
2091,i do not think there will be,jeremy corbyn has already accepted that there is going to be a run on the pound in the event of a labour government.
2092,incidences of hepatitis is sic also hitting the 11 16 year old age group,the recent rise in cases of hepatitis in children is primarily affecting children aged one month to four years old who have been actively breastfed in the last 12 months. all the children were breastfed by vaccinated mothers.
2093,so sad for meghan as she was denied to join the funeral by queen's last order,duchess meghan was denied entry to queen elizabeth ii's funeral
2094,"because i think the return of university students will lead to an increase in spread and could have a negative impact, i am just not convinced it will be quite on the scale that is predicted","the return to universities could cause 50,000 deaths from covid 19 without strong controls ."
2095,"by giving credit to bush, a cis het white male, conspiracy theorists show a lack of respect for the agency of muslim immigrants.",an article was published in the atlantic with the headline the soft bigotry of bush did 9 11 .
2097,"did you know that a pinch of cream of tartar under your tongue, may assist with dizziness, vertigo, headaches, migraines? let it dissolve under your tongue it may taste a little tart but do not worry, it will quickly disappear. this is a potassium salt boost, so make sure that you listen to your body.",cream of tartar can cure migraine pain
2098,"although noone truly knows the because, it is undeniable that temperatures have risen over the past 20 years. look at the temperature records and average snowfall.","the us has not warmed in 18 years, so emissions driven warming is a hoax"
2102,"this is my granny, mrs stalla smith. she turns 105 today. any chance i can muster 210 shares double her age here on facebook? she will be amazed and baffled in equal measure. thank you",relatives of a 105 year old grandmother are asking facebook users to share a post 210 times.
2103,rahul gandhi with a glass of alcohol and chicken,tapasvi is engrossed in penance
2104,we do not bankroll,just stop oil bankrolls the labour party.
2105,"be careful of vaccinated people spreading covid to you! they are a threat to the unvaccinated. less severe symptoms means they may not know they have it and then may spread it to you, putting your life at risk they are the real threat. the ones who are spreading it unknowingly.","with covid 19, vaccinated people ""are the real threat to"" unvaccinated people."
2106,dr. fauci's wife's secret plan to put psych drugs in drinking water,anthony fauci s wife has a secret plan to put psych drugs in drinking water to get people vaccinated.
2107,"this fall is not driven solely by the vote itself new english language requirements were also introduced in 2016 for example , but just as with the francis report, the timing is hard to ignore.",a new english language test has been introduced for nurses which means that some people who would otherwise have been able to practice cannot.
2108,"traditionally, the speaker says ""members of congress, i have the high privilege and distinct honor of presenting to you the president of the united states."" speaker pelosi said ""members of congress, the president of the united states.""","traditionally, the speaker says members of congress, i have the high privilege and distinct honor of presenting to you the president of the united states. tonight speaker pelosi said, members of congress, the president of the united states. """
2109,"they were seeing signals that were unusual, and so they consulted the dmed database and were shocked to find enormous increases in 2021, when the vaccine mandates were implemented to the military, compared to 2020 in a wide variety of diseases, including cancers, things related to reproduction and female reproductive health",data from the us military shows a sharp rise in the incidence of various diseases in 2021.
2111,"malabar gold is a muslim owned shop, scholarship is given only for the muslim girls. we hindus should...?","malabar gold is a muslim owned shop, scholarship is given only for the muslim girls. we hindus should...?"
2113,a plea from nhs staff. please please please make sure you and your family all dig out your nhs number and have a copy of it it sic immediately to hand for when you or they are called for the covid jab. from my colleagues on the front line this is far and away the biggest bottle neck when it comes to administering the vaccine to as many people as quickly as possible. you can find your nhs number on any nhs correspondence or through the app. it would also be really helpful if you can share this message with everyone you know. thank you,make sure you and your family all dig out your nhs number and have a copy of it immediately to hand for the covid jab. nhs staff on the front line say this is the biggest bottleneck when it comes to administering the vaccine to as many people as quickly as possible.
2114,"no more lockdowns, no more mask mandates. let us get our kids back in school.",the seasonal cold and flu is actually more dangerous for kids than the coronavirus and there is very low transmissibility from children to their families and communities.
2115,where did you make tattoo of poor raut?,shiv sainik got sanjay raut's tattoo get on his body
2117,"where possible, information on differences in the average awards paid to men and women is taken into account",86 of austerity has fallen on women.
2118,"god should not give such a son to the enemy, who neither takes off his shoes nor takes off his coat nor takes off his cap at the funeral of his father but performs the last rites of the father only by becoming a big leader by putting a thread on the jacket. he is the hopeless son, god should not give such a son to the enemy. friends, what is the use of earning thousands of crores of wealth by becoming mla, mp, minister, or chief minister? when the real son also does not perform the last rites properly",akhilesh yadav wore shoes during his father's funeral
2119,"two letters to the nejm just published pfizer says new data shows 1 dose is 93 effective after 2 weeks, almost as good as 2 doses. they urge a change in policy to single dosing. moderna basically saying their vaccine is good against all variants except possibly s.a.",pfizer has recommended switching to a one dose policy for its vaccine
2120,an estimated 350 people marched through london today in protest over covid restrictions and vaccines,bbc news reported that 350 people attended the anti lockdown protest in london on 29 may 2021.
2121,"this information is not routinely collected for business purposes, so we hold no comprehensive list of this nature",321 uk parliamentarians have irish passports
2122,"breaking there has been a explosion near the police lines peshawar, khyber pakhtunkhwa. initial reports suggest the mosque inside the police lines police rescue 1122","a picture shows rescue authorities, and others, in the aftermath of a blast on 30 january 2023 in the police lines neighbourhood of peshawar, pakistan."
2124,"the arrest of manish sisodia, a descendant of maharana pratap, has hurt this man the most","bhagwant mann stumbled and fell during a public meeting in moga, punjab"
2125,oh shame.,a hindu boy manoj pandey 15 yrs old stabbed to death by islamist jihadis in patel nagar for protesting against the molestation of his sister. mughal 2.0 in india
2126,"reporter why force a rape or incest victim to carry a pregnancy to term? gov. greg abbott r tx ""it does not require that at all, because obviously it provides at least 6 weeks for a person to be able to get an abortion.""",the texas abortion law provides at least six weeks for a person to be able to get an abortion.
2127,"tight, corked tongue, very tortured, so i could think of traditional herbal medicines at home. so try to find something to eat is to fetch water from the banana tree any banana tree, such as nam wa, kluai khai, wild banana, the better. measure water from the banana tree in the early morning. the oil will flow better than late morning. take two spoons a day. it will feel better and will gradually disappear. eat regularly to get very good results. i have been eating for 15 days. currently, i am completely healed. guarantee that it is gone. never come back again",liquid extracted from banana trees is beneficial in treating acid reflux
2128,"five visits that have defined european history most in the post wwii era kennedy in berlin, brandt in warsaw, john paul ii in warsaw, reagan in berlin and biden in kyiv.","five visits that have defined european history most in the post wwii era kennedy in berlin, brandt in warsaw, john paul ii in warsaw, reagan in berlin and biden in kyiv."
2129,where is the a 10s when you need one!,"""antifa encampment spotted in downtown portland"""
2130,"after the miss india contest, once again the issue of farmers' protest echoed on mtv, judges have given a standing ovation... now that the matter has come out, it will go far...",a rap song in support of the farmers protest was played recently on mtv channel.
2131,"do you know, that groundnut can tighten your pussy without side effect? try this and thank me later. . god is wonderful! direction procedure get raw groundnut ..sun dry it for 2days ,soak together with the she will back overnight with water drink it in the morning for 4days stop it on 5th day to see the results. you can re soak it with water every day if the water get finished.. please do not take too much other wise the place go too tight o, except you want it to be broken the second time. lol. you can still use your google to know more about it and thank me later.",groundnut water tightens the vagina
2133,watch live blue origin's rocket is minutes ahead of the historic launch,says jeff bezos will put 300 metric tons of carbon into the atmosphere for 180 seconds in space.
