PID,Social Media Post,Normalized Claim
544,figures for influenza and pneumonia represent where either of these causes have been mentioned anywhere on the death certificate meaning they will not necessarily be the underlying because of death,flu is killing many more people than covid 19 at the moment.
546,"i speak frankly, bollywood has spread filth in my country, is there anyone else who can stand with me fearlessly. keep joining me i will follow back everyone.",mukesh khanna targeted bollywood in a tweet
547,postal voting applications forms cannot be downloaded online. this is corruption number one by supervisor of elections,fiji postal voting application forms for the national election cannot be downloaded online.
548,"indian prime minister, narendra modi, has been involved in the creation of his figure and gave madame tussauds renowned artists a sitting at his residence in new delhi earlier this year",prime minister narendra modi has hired a makeup artist who is paid 15 lakh rupees a month
549,"these regulations provide for extension of the time limits that apply to the retention of certain fingerprints or dna profiles. the regulations apply in respect of fingerprints or dna profiles that are retained under certain counter terrorism provisions, or that may otherwise be relevant to the interests of national security",the government has brought in legislation that allows dna from covid 19 tests to be harvested and retained.
550,"so far, there have been no cases of people being infected by neocov and scientists are urging more research to establish if it can infect humans or not","a new type of coronavirus, neocov in south africa with a high death and transmission rate"
551,"doug jones has fought to use our taxpayer dollars to fund abortions, and he has even said he supports abortion until a child is born. doug jones is a disgrace.","says doug jones ""has voted to spend our tax dollars on late term abortions"" and ""supports abortion up until birth."""
552,"former us president donald trump issues a statement congratulating elon musk on his purchase of twitter. ""...i have been told that my account will be back up and running on monday we will see,"" reads his statement.","former us president donald trump issues a statement congratulating elon musk on his purchase of twitter. ...i have been told that my account will be back up and running on monday we will see, reads his statement."
553,"what is your reasons for not getting the shots? some of my reasons they lied about the death rates any death within 60 days initially, 28 days subsequently of a positive test using a not fit for purpose diagnostic tool. they lied about the infection rates due to this hardly anyone had died solely of covid the local and regional news was released simultaneously to create the propaganda of fear they changed the pcr cycles to find cases and justify lockdowns the rules did not make any sense the flu disappeared most importantly i did a lot of research",hardly anyone died solely of covid 19.
555,amazon returned products giveaway 10.000 free products for you,amazon returned products giveaway 10.000 free products for you
556,"big breaking quarantined by mumbai police, ips vinay tiwary will join cbi probe.",ips vinay tiwari will join cbi to further investigate sushant singh rajput's case.
557,"26th 27th september bank strike announced br 28th september is 4th saturday, br 29th is sunday. br 30 th half yearly closing. br 1st most staff will be on leave. br oct 2 gandhi jayanthi holiday. br so after 25th sept. next working day will be 3rd october. 7 days no bank work will be there",banks announced strike on september 26 27
558,absolutely no!!!!!! this is so wrong on so many levels! leave a comment on their page please !,"the cdc is about to add the covid vaccine to the childhood immunization schedule, which would make the vax mandatory for kids to attend school."
559,"electric bill in ilocos norte, 74 pesos. electricity bill in ilocos norte, php 74.64 only. under the leadership of the marcoses, the people of ilocos were proud of what they paid at the end of the month. their electricity is very cheap compared to other places and especially in metro manila where meralco charges people thousands. do you want the entire philippines to have this low electricity bill? let us join bongbong marcos.","the cost of electricity in ilocos norte, under the leadership of bongbong marcos and imee marcos, is cheaper than in metro manila"
560,wild animals in kerala are confused. shrinking natural habitat. shortage of food.,wild animals in kerala are confused. shrinking natural habitat. shortage of food. biodiversity overpopulation
561,"total employment, while up on the quarter, remains below its pre pandemic level. since the start of the pandemic, around half a million more people have completely disengaged from the labour market",more people are in work than before the covid 19 pandemic.
562,"new ad from app pac says he supports sex changes for kids. should eight year olds really be subjected to dangerous, life altering medical procedures? that is going way too far.","""joe biden says he supports sex changes for kids."""
563,"what have the tories done with our mhs since 2010? the rate of extra investment has fallen by 68 16,481 fewer beds in hospitals 66 a e and maternity wards closed 103 nhs walk in centres closed or downgraded 60 ambulance stations closed 1,000 gp practices closed a e 4 hour targets missed more than 10 million times number of patients waiting more than 12 hours in a e spending on adult social care down 8 5,240 fewer mental health nurses the number of operations classed as urgent that have been cancelled twice have doubled 22 drop in ambulances meeting their 15 minute",a e four hour targets have been missed more than 10 million times since 2010.
564,"donald trump responds to transportation sec. pete buttigieg pointing out that his administration rolled back regulations on the rail industry ""i had nothing to do with it.""",i had nothing to do with it.
565,"beautiful moment during when stadium paused to offer . is a fantastic opportunity to showcase to world, importance of peace compassion in . is doing a great job, highlighting diversity culture of islamic states","beautiful moment during qatarworldcup2022 when qatar stadium paused to offer prayers. fifaworldcup2022 is a fantastic opportunity to showcase to world, importance of peace compassion in islam. qatar is doing a great job, highlighting diversity culture of islamic states"
567,do we not know if tamil nadu will become a superpower?! a white man works on road in chennai...,foreigners in chennai road construction works
568,just in elon musk bans greta thunberg from twitter..,elon musk banned greta thunberg from twitter
569,broken news taliban terrorists in afghanistan ban use of mobile phones in the country. they gathered them and set all ablaze.,taliban destroying phones in afghanistan
570,"just in matapos patul0y na panin!ra sa gobyerno, koring harapang tinuld0kan, lisensya tanggal na!",korina sanchez's journalism license was revoked because she has been discrediting the duterte government.
571,rumint pakistan had denied airspace to indian ndrf plane with relief material to . it had to take a detour.,rumint pakistan had denied airspace to indian ndrf plane with relief material to turkey . it had to take a detour. turkeyquake
572,"""if the fake santa, cory aquino, had not stopped it, it would have greatly helped our economy. investors can encourage us to do business because electricity is cheap. this can cause a lot of work. it is like in korea that built the same model of the bataan nuclear power plant, which now has its own manufacturing of appliances, gadgets, cars and whatnot. and because they found it effective, they built more, that is why the korea their country is very developed. are we here? slandered. closed. the yellow people are that devilish, just so that the name of pres. marcos, they will do everything to prevent his projects from being exploited, instead they sacrificed the good that it will bring to our country. because the infrastructures cannot eat people, said the fake santa cory. after all, what they want is garbage. they are like yellow. ""","president corazon aquino shutdown the bataan nuclear power plant, a project of her predecessor ferdinand marcos sr., because she ""did not want filipinos to remember the marcos family."""
573,it is not my job to worry about people starving to death in the uk,it is not my job to worry about people starving to death in the uk
574,distracted aam aadmi,distracted aam aadmi tharkikejriwal
575,it is not monkeypox. it is vaids.,monkeypox the same as vaids caused by the covid 19 vaccine
576,hindu and hindutva wadi will be thrown out.. we should throw ?? where do you throw.. out of the nation or politics. rahul gandhi to clarify.hindus did not defeated or thrown.. hindus repeated the history.. hindu's will repeat the history remember.,hindu and hindutva wadi will be thrown out.. we should throw ?? where do you throw.. out of the nation or politics. rahul gandhi to clarify.hindus did not defeated or thrown.. hindus repeated the history.. hindu's will repeat the history remember.
577,there is no evidence of differences in the proportions testing positive for covid 19 between the age categories,children and adults have the same chance of getting ill from covid 19.
578,a research from us report premium salt in india contains deadly cyanide. beware.,branded salt contains cyanide
579,"our products are completely animal free and plastic free! our clothing is also certified net carbon neutral, created from natural or recycled materials in fair trade factories, printed using water based inks, and made to last",animal agriculture is the biggest contributor to climate change
580,"iran sentences 15,000 to death as a 'hard lesson' for all rebels","iran has sentenced around 15,000 protesters to death."
581,how has no one in the media found this anthony fauci clip sooner? he actually makes sense. source c span,"a 2004 interview shows dr. anthony fauci, director of the you.s. national institute of allergy and infectious diseases talking about innate immunity against flu. on social media, multiple media users have linked this old interview with covid 19 virus to claim that dr. fauci s advice should apply equally to covid patients. we fact checked and found the claim to mostly false."
582,"joe biden completely botches the pledge of allegiance ""i pledge allegiance to the united states of america, one nation, indivisible, under god, for real.""",claim joe biden botches recitation of the pledge of allegiance
583,if positive results are received the school will secure the individual concerned and in the case of students inform parents carer immediately we will then operate our usual process of identifying others who may have been in close or direct contact for our self isolation system will be put in place.,a letter sent by a liverpool school claimed consent was not needed to test children for covid 19 during a city wide testing scheme.
584,"seems all of delhi is going to be behind bars for the next 6 months. by the way, happy diwali to all delhiites","seems all of delhi is going to be behind bars for the next 6 months. by the way, happy diwali to all delhiites"
585,looking forward to the fact check on this one.,unvaccinated people not dying from covid 19
586,"it is national lead poisoning prevention week. i am so glad we have a governor who cares and wants to help wi cities get to 0 lead piping. sadly, in 2019, republicans stripped 40 million from the budget for lead pipe replacement because they thought it helped mke too much.","""in 2019, republicans stripped 40 million from the budget for lead pipe replacement because they thought it helped mke too much."""
588,"as i learn more and more each day, i am coming to the conclusion that what is taking place is not an impeachment, it is a coup, intended to take away the power of the....","""as i learn more and more each day, i am coming to the conclusion that what is taking place is not an impeachment, it is a coup."""
589,bharat joda yatra bellary .. this enough to spoil few diapers .,bharat joda yatra bellary .. this enough to spoil few diapers .
590,we need to raise nc teacher pay to at least the national average which is where it was back when i was in public school. i benefited from our state meeting that challenge and now we need to meet it again for the next generation.,"says north carolina's average teacher salary was at the national average ""back when i was in public school."""
591,"not only is public transport free in brussels, but they even have a bus called ""not the 48"" which takes you to a mystery location if you are feeling a bit down or you just do not have anything to do that day something for other cities to consider",public transport is free in brussels and there is a bus there called not the 48 which takes you to a mystery location.
592,"the scene is the final of men's high jump at the olympics. italy's gianmarco tamberi was facing qatar's mutaz essa barshim in the final. both of them jumped 2.37 meters and were on par. olympic officials gave three more attempts to each of them, but they were unable to reach more than 2.37 meters. one more attempt was given to two both of them. the moment when there was no other opponent in front of barshim, the moment when he could have easily approached the gold alone ! but barshim asked the official ""if the gold can be shared between the two of us if i withdraw from the final attempt ?"" the official checks and confirms and says ""yes then the gold will be shared between the two of you"". barshim then had nothing to think about, announces withdrawal from the last attempt. seeing this, the italian opponent tamberi ran and hugged barshim and screamed ! what we saw there was a great share of love in sports that touches our hearts. it reveals the indescribable sportsmanship that makes religions, colors and borders irrelevant !!!",qatar s barshim decided to share the men s high jump gold medal with italy s tamberi in tokyo olympics after tamberi withdrew from the last attempt due to a serious leg injury
593,"on 20 december 2021 , a number of documents were submitted at a west london police station in support of allegations of criminality in relation to the uk",the metropolitan police is investigating the covid 19 vaccine programme.
594,monkey pox looks like the leprosy cartoon pictures that used to be in the bible study and vbs lessons,monkeypox is another name for leprosy
596,"so who is really to blame here? in 2010 bob brown led the australian greens with the alp which allowed prime minister julia gillard to form government. as a result of this the greens gained the balance of power and signed the native forest protection act, which defunded national park rangers and control burn programs.",australia s brutal bushfire season might be easing but efforts to assign blame for the disaster continue to blaze on social media.
597,"we should be investing in jobs and education, not more jails and incarceration.","""last year, south carolina spent 21,756 per prison inmate and 11,552 per student."""
598,"when a registered dealer refuses cash for goods, the goods are yours for free","if a registered business refuses cash for goods, the goods are free."
599,"italian higher institute of health adjusts number of deaths due to covid alone since february 2020 downwards from over 130,000 to under 4,000","the national health institute in italy has recalculated the covid 19 death toll from 130,468 down to 3,783 directly due to covid 19, or 2.9 of the total."
600,"unless every state government comes up with supporting it is farmers like this, pollution cannot be tackled. up farmers need not burn the stubble","the up government is procuring stubble from farmers, nearly 5000 quintals of stubble is procured, and farmers are given cow dung in return"
601,mic is off but comedy is on,mic is off but comedy is on
602,mike pence caught on hot mic delivering empty boxes of ppe for a pr stunt.,mike pence carried empty boxes of ppe into a medical facility as a publicity stunt.
603,they will try everything to steal it. we will not let them!,the claim results of arizona gubernatorial race aired ahead of election day show attempt to steal election
604,"taob si leni sa pabahay ni pbbm! 3k units patapos na,di binabalita ng media? tiktoker may bwelta! thank for watching","bongbong marcos housing project in deparo, caloocan has 3,000 units, and the media has not reported about it"
605,wef globalism they do not even try to hide this stuff.....,european central bank president discusses gene therapy at wef conference
606,"this is a rohingya family. destitute on a road in delhi. together with 8 children, 3 wives, out of which 2 are also pregnant. in hand is samsung c7 pro mobile which costs only rs 29,000. the opposition is sad to see their condition, so keep paying taxes on time.","this is a rohingya family. destitute on a road in delhi. together with 8 children, 3 wives, out of which 2 are also pregnant. in hand is samsung c7 pro mobile which costs only rs 29,000. the opposition is sad to see their condition"
608,coronavirus vaccine caused liver inflammation in test animals,"all animals used in covid 19 vaccine trials died months later from immune disorders, sepsis and or cardiac failure."
609,this is the condition of examination centres and govt. wants to conduct exam's .,images of flood hit jee and neet 2020 examination centres in india
610,"there were 229,000 new cases of coronavirus in the world yesterday. the uk provided 20 of them. 1 in 5 of the new cases in the whole world was on our little island.","the uk provided 20 of the new cases of coronavirus in the world on sunday, 17 october 2021."
611,"being vegan for a year saves 365 animals, 1,000 square metres of forest, 3,320 kg of co2, and 6,670 kg of grain.",being vegan for a year saves 365 animals.
612,the money the tories spaffed on test trace would have paid for a 15 pay rise for every nhs worker from now until 2058. they took that money gave it to their pals.,the money wasted on nhs test and trace would have paid for a 15 pay rise for every nhs worker from now until 2058.
614,ellen degeneres is on house arrest for child sex trafficking,"ellen, oprah, tom hanks and many other well known politicians and celebrities are under house arrest for child sex trafficking"
615,this is a historic picture of kejriwal submitting written apology to nitin gadkari for making false allegations!,picture of kejriwal submitting written apology to nitin gadkari for making false allegations!
616,extraordinary footage tracking a million people demanding a new brexit vote. now released by but censored from at the time.,footage of a million people attending the people s vote march in march 2019 was censored by bbc news at the time but has now been released by bbc politics.
617,"bizarre advisory by canada has advised its citizens to avoid all travel to areas in states of , and , which share a border with pakistan due to the ""presence of landmines"" and ""unpredictable security situation"".","canada lost it or what ? canada has advised its citizens to avoid all travel to areas in states of gujarat, punjab and rajasthan, which share a border with pakistan due to the presence of landmines and unpredictable security situation."
618,"pineapple is that fruit which is readily available in all supermarket stores and market and is eaten in many homes around the world. pineapples are very common that people can choose to eat them any how they want, they can eat them in solid form, dried, or even in juice form. in some countries, pineapple is not only loved for its sweet taste but also it has been used for centuries to cure digestion issues and inflammation. visit lnk.bio for more",pineapple can improve bone health
619,"horrific. tsunami after the earthquake hit the coast of turkey. recently released update so far 2,379 people have been killed and 13,293 injured.",visuals of tsunami waves that hit turkey after the earthquake on 06 february 2023
620,"colloidal silver is a big time go to almost any type of health issues especially if you are worried about covid 19. it can aid in wound healing, improve skin disorders, either prevent or treat diseases like flu, pneumonia, herpes, eye infections, shingles, cancer, and aids.",colloidal silver can be used to treat covid 19
621,"the gambling commission found that overall, gambling was down during lockdown due to the loss of things like football",betting on online slot machines has increased by 25 during lockdown.
622,"... so in the situation that you just gave, a ukrainian living and working here, you will be able to bring your family here to the uk under the extended family scheme",ukrainians in the uk on a work visa can bring family members to the uk under the ukraine family scheme.
624,"13,783 cases of shingles one of the adverse effects of c19 jab are reported on the vaccine adverse event reporting system. seems like shingles is being termed as monkey pox. soon, more jabs would be injected to control this ""monkeypox"". and that would cause another side effect!","13,783 cases of shingles, one of the adverse reactions of the covid vaccines, are reported on the vaccine adverse event reporting system."
625,"let me get this straight... a party that supports abortion over life, illegals over it is own citizens, and refugees over it is homeless veterans, is going to lecture me on morals? i do not think so cupcake.",sam elliott does not support political party of abortion
626,"rigged 2020 election millions of mail in ballots will be printed by foreign countries, and others. it will be the scandal of our times!","rigged 2020 election millions of mail in ballots will be printed by foreign countries, and others. it will be the scandal of our times!"
627,"my build back better agenda costs zero dollars. instead of wasting money on tax breaks, loopholes, and tax evasion for big corporations and the wealthy, we can make a once in a generation investment in working america. and it adds zero dollars to the national debt.","""my build back better agenda costs zero dollars."""
628,figures published last week revealed 10 of criminal barristers involved in legally aided work have withdrawn from those cases in the past year.,10 of criminal barristers have quit in the past year.
629,"high alert chicken infected from corona virus found in bangalore today, kindly circulate the message and avoid consumption of chicken. spread to your dear ones",chicken infected from coronavirus found in bangalore
630,"dmk's briefcase is a wise, cunning driver",kanimozhi s car driver is the one who threatened vijaya sethupathi s daughter following the 800 film controversy.
631,"acting superstars doing lunger with an empty plate and mask on. insulting of gurudwara sheab. always insulting and making fool to public, who asked them to fake acting in gurunakaji temple","acting super stars doing lunger with empty plate and mask on. insulting of gurudwara sheab. always insulting and making foolsto public , who asked them to fake acting in gurunakaji temple."
632,mass crowd gathered at a rally in bihar to listen to yogi adityanath ji. the plains echoed with slogans of jayshreeram,mass crowd gathered at a rally in bihar to listen to yogi adityanath ji. the plains echoed with slogans of jayshreeram
633,the uk and eu are working together on sanctions and different measures are quicker to implement in some places than in others. on bank sanctions for instance we are leading the way. in other areas the eu is. the west is united unlike the bit of twitter still unhinged by brexit,"the uk has sanctioned 258.8 billion of russian bank assets, while the us has sanctioned 240 billion and the eu 38.8 billion."
634,gujarat ke election me muslims ko voting karne se police aur bjp walo ne roka,muslims prevented from voting in gujarat by bjp and police
636,"the british have always acknowledged the impact of ancient indian civilization! at the funeral services of the late queen elizabeth ii, sanskrit shlokas being recited for the well being of her soul!","the british have always acknowledged the impact of ancient indian civilization! at the funeral services of the late queen elizabeth ii, sanskrit shlokas being recited for the well being of her soul!"
637,muhammad owned many slaves. robert e. lee was against slavery. so why are we tearing down statues instead of mosques?,"says ""muhammad owned many slaves"" while robert e. lee was ""against slavery."""
638,may help with the possible negative affects sic,homeopathic nosodes could help with vaccine side effects.
639,this product has ginger extraction that helps your hair follicles to be strong and make your hair fuller and thicker. how to works,using ginger can regrow your hair in 21 days
640,a poll watcher in philly was just wrongfully prevented from entering the polling place,poll watchers in philadelphia prevented from entering polling places.
641,"the kyiv regime's bogus claim that russian missile hit a maternity hospital. laura ru writes more info is emerging about the fake scene staged at the mariupol hospital. the actress model, marianna podgurskaya, is shown in younger, non pregnant days. she was recognized by acquaintances who then discussed her mariupol performance on signal.",the russian attack on a mariupol maternity hospital was staged
642,"msnbc actually said on the air ""i hope enough people die from coronavirus that it harms trump's re election"" no shame.",msnbc actually said on air i hope enough people die from coronavirus that it harms trump s re election.
