PID,Social Media Post,Normalized Claim
1196,"earlier in other states it was a practice to make bjp members taste fenugreek, now it continues in gujarat as well","earlier in other states it was a practice to make bjp members taste fenugreek, now it continues in gujarat as well"
1197,"it is clear the fbi needs to be held accountable. congress must begin considering meaningful reforms. for too long, the biden family has peddled access to the highest levels of government and the fbi has been slow to act. americans deserve better.","hunter biden s committed serious crimes, as you mentioned, 150 suspicious activity reports. those are the most severe bank violations. this is when the bank notifies the federal government that we are pretty confident our client has committed a crime."""
1198,"from my lockdown room in things look grim, but here is some positive advancements china has closed down its last coronavirus hospital. not enough new cases to support them. doctors in india have been successful in treating coronavirus using...combination of drugs used lopinavir, retonovir, oseltamivir along with chlorphenamine. they are going to suggest same medicine, globally. researchers of the erasmus medical center claim to have found an antibody against a 103 year old chinese grandmother has made a full recovery from after being treated for 6 days in wuhan, china. apple reopens all 42 china stores, cleveland clinic developed a test that gives results in hours, not days. good news from south korea, where the number of new cases is declining italy is hit hard, experts say, only because they have the oldest population europ scientists in israel likely to announce the development of a vaccine. 3 maryland coronavirus patients fully recovered able to return to everyday life. a network of canadian scientists are making excellent progress in covid 19 research.a san diego biotech company is developing a vaccine in collaboration with duke university and national university of singapore. tulsa county's first positive covid 19 case has recovered. this individual has had two negative tests, which is the indicator of recovery. all 7 patients who were getting treated for at safdarjung hospital in new delhi are recovered plasma from newly recovered patients from covid 19 can treat others infected by it is not all bad news. let us care for each other and stay focused on safety of the most vulnerable",all seven patients who were getting treated for covid 19 at safdarjung hospital in new delhi have recovered.
1199,congratulations join bjp join bjp,sachin pilot has joined bjp
1200,"eight twitter accounts, over 6 days, with an average follower count of 28. why did they all tweet exactly the same thing?",accounts on twitter resharing a post about journalism failing to capture the mood of the country is a coordinated bot effort.
1201,"with this ban, millions of people will become felons overnight, and they will not go quietly",millions of people will become felons overnight because of the assault weapons ban of 2022.
1202,"most of these deaths would normally have occurred in hospital, and people have either been reluctant to go, discouraged from attending or the services have been disrupted. it is unclear how many of these lives could have been extended had they gone to hospital","the number of deaths from diabetes is up 86 , from prostate cancer is up 53 , from parkinson s is up 79 , from breast cancer is up 47 and from bowel cancer is up 46 ."
1203,40 students admitted after vaccination in kanpur,a viral post with a newspaper clipping of headline reading about 40 students admitted after vaccination in kanpur is shared with a claim that it is the situation soon after injected with covid 19 vaccine in india.
1204,"5. what is most found in gmo foods? glyphosate, as the main ingredient in genetically modified food, actually encourages the body to accept and absorb aluminum. and then glyphosate and aluminum work together to double down on brain and gut health. both glyphosate and aluminum",soy causes alzheimer s disease
1206,jio is giving everyone a reward up to rs 10000. click to receive the money into account.,"jio is giving a reward of up to rs 10,000"
1207,"damn you what business is close to the queen of england? 2g profits outpace royal family closeness? even though gopalapuram chases away, victoria puram welcomes you! dr. macham","what business is he doing to meet the queen of england? 2g profit has made him connect with the family of the england queen. though gopalapuram throws him out, victoria puram is welcoming him"
1208,dan bishop is just as off the rails as trump,"china has ""had now the worst year in 57 years."""
1209,nih's own website states that covid 19 was a planned and orchestrated scam demic. link in the comments.,the us national institutes of health s own website states that covid 19 was a planned and orchestrated scam demic.
1210,this is racism. and it is completely shameful. especially when it comes from someone running to be the mayor of our diverse and multicultural capital city.,"diane abbott once said the problem in britain is not immigration, the problem in britain is white people."
1211,"23 of you say your child will wear a mask at secondary school because the school have asked, and a further 15 will do so despite it not being mandated",23 of parents of secondary pupils will insist their children wear masks when they return to school.
1212,our position has been consistently pro freedom pro choice hence we start no a vac mandates end mass testing campaign next week we are also for open debate everywhere this is astonishing interview of dr robert malone by neil oliver no more big tech take downs! end vac passports,covid 19 vaccine is unsafe for children
1213,"rep. adam schiff illegally made up a fake terrible statement, pretended it to be mine as the most important part of my call to the ukrainian president, and read it aloud to congress and the american people. it bore no relationship to what i said on the call. arrest for treason?","says house intelligence chairman adam schiff could be eligible for ""arrest for treason."""
1214,"at the moment only 11 of people who are asked to self isolate by the nhs app are actually able to do so, many of them not eligible for a one off payment to help them do that",research shows that only 11 of people self isolate when asked to do so by nhs test and trace.
1215,"this is entirely disturbing, but not at all surprising. can any pilots out there confirm this is true?",pilots started training for sudden death during a flight in 2022
1217,pfi and islamic jihadi organizations called for strike today and congress stopped its padyatra today nothing could be worse and more shameful than this,pfi and islamic jihadi organizations called for strike today and congress stopped its padyatra today nothing can be more disgusting and shameful than this
1218,"friends, if you want to make your teeth even more white, then i want to share with you an easy way that will make your teeth shine like pearls in just 5 minutes. i came to know about it a few years ago and since then i myself have tried it quite a lot of times and believe me friends, every time it works like a magic. the best part is that it is so easy to do that even the most lazy of us will do it very comfortably. it is a 100 natural remedy that does not have any side effects. and the funny thing is that only one ingredient is needed to do it. i think this is the best time to talk about it because that ingredient is easily available this season. and that ingredient is strawberries.",strawberries whiten your teeth without leaving any side effects
1219,"if you are going to visit gir in gujarat, then definitely check before using the accessible toilet or else the toilet will not be used",","
1220,"friends, chacha nehru working for women","friends, chacha nehru working for women"
1221,wow! a 100 year old man joined the million strong london march yesterday. a man who in his most senior years has more brains than most males in their prime. 100 years old!!!!!!!!,a million people attended the anti lockdown march in london on 24 april 2021.
1223,"officials sabotaged election day. on november 8th when 75 of votes were for nearly 1 4 of a million voting attempts failed, according to the system log files that were obtained via foia. this is huge, folks. huge.","nearly 250,000 voting attempts failed in arizona midterm election"
1225,biden calls for banning oil companies from drilling,says joe biden just announced on cnn he will completely shut down drilling for oil and natural gas on day one of his administration.
1226,"almost one million people request tickets for the saturday night rally in tulsa, oklahoma!","donald trump is recruiting excited and enthusiastic minority actors and actresses to appear at his campaign rally in tulsa, okla."
1227,pongal lunch hosted by pm rishi sunak in london. grt idea ...! will try to do for my north indian frnds,pongal lunch hosted by pm rishi sunak in london. grt idea ...! will try to do for my north indian frnds
1228,"""nobody making under 400,000 will have their taxes raised. period,"" says .","biden s tax rate on a family making 75,000 dollars would go from 12 to 25 ."
1229,"like this friends, this has saved 300 lives of passengers","like this friends, this has saved 300 lives of passengers"
1230,to save on you are electricity bill this winter all you need is a small piece of wire. do the right thing this winter and stay warm f the electric companies sic,to save on your electricity bill this winter all you need is a small piece of wire to bypass your electricity meter.
1231,read this cutting of old news paper of 1987 the name of rapist is arvind kejriwal student of itt .,read this cutting of old news paper of 1987 the name of rapist is arvind kejriwal student of itt.
1232,people are dying due to lack of oxygen our health minister is cutting ladyfinger,people are dying due to lack of oxygen our health minister is cutting ladyfinger.
1233,hey is this pic true ? if yes then you can count your remaining days in,hey deepikapadukone is this pic true ? if yes then you can count your remaining days in bollywood boycottpathaan boycott pathan
1235,"yesterday i signed four measures that will massively reduce the prices of prescription drugs, in many cases by more than 50 . nothing like this has ever been done before because big pharma, with its vast power, would not let it happen. expensive insulin went from big dollars.....","under an executive order, expensive insulin went from big dollars to virtual pennies ... especially for our seniors."
1236,thanks to italian doctors who finally disobeyed who is global health law not to perform an autopsy on the dead coronavirus and they discovered that it is not a virus but bacteria that causes death!!! it causes blood clots to form and results in the death of the patient. families world wide should start asking for autopsies on their dead relatives!,"covid 19 is bacterial, not viral, and can be easily treated with aspirin"
1237,"in certain swing states, there were more votes than people who voted, and in big numbers. does that not really matter? stopping poll watchers, voting for unsuspecting people, fake ballots and so much more. such egregious conduct. we will win!","in certain swing states, there were more votes than people who voted, and in big numbers."
1238,"chamcho bernal mangwa lo, ab cheetah bhi camera dekh ke pose dete hai. according to some eminent scholars, this latest picture has come from kunho sanctuary in madhya pradesh. these are the cheetahs which have been brought to india from namibia by modi ji. how these leopards are sitting like the three lions of ashoka, the symbol of india",viral image of three cheetahs is of kuno national park
1239,"this is a guy who added his infected blood to cadbury products. for the next few week do not eat any products from cadbury, as a worker from the company has added his blood contaminated with hiv aids . it was shown yesterday on bbc news. please forward this message to people you care",cadbury products contaminated with hiv positive blood
1240,"from the papua new guinea courier ""great britain, the birthplace of newtonian physics no less that is now likely to be led by a woman so dense thatlight bends around her.""",an article published in a papuan newspaper criticises the state of affairs in the uk.
1241,indian army sniper armed with sako trg 42 .338 lapua magnum sniper rifle along a king cobra somewhere near lac at arunachal pradesh,indian army sniper armed with sako trg 42 .338 lapua magnum sniper rifle along a king cobra somewhere near lac at arunachal pradesh
1242,ktnkenya would like to inform the public that it has no record of the cs treasury ever releasing any statements regarding the future state of the economy and would like to distance itself from it.fake news this is,ktn news flagging a tweet about the national treasury.
1244,what inevitably stops these horrific crimes armed good guys stopping armed bad guys.,what inevitably stops these horrific crimes armed good guys stopping armed bad guys.
1245,the data from the higher institute of health say that 96.3 died of other diseases,96.3 of the italy s covid 19 deaths were actually caused by other diseases.
1246,your amazon account are on hold due to a billing issue. update payment information,email from amazon asking to submit personal information by clicking on a link
1248,"the biden family was paid off, pure and simple! the fake news must stop making excuses for something that is totally inexcusable. sleepy joe said he never spoke to the ukrainian company, and then the picture came out where he was playing golf with the company boss and hunter.....","says joe biden ""said he never spoke to the ukrainian company, and then the picture came out where he was playing golf with the company boss and hunter"" biden."
1249,celebrates with bsf jawans and celebrate the victory of mkg1,recent pictures of kangana ranaut celebrating vijay diwas with bsf jawans
1250,"according to the nhs all underwear, towels and household linen should be washed at 60c or 40c with a bleach based laundry product to prevent microbes spreading",the nhs recommends washing your underwear and towels at 60c or 40c with a bleach based laundry product to prevent the spread of the new coronavirus.
1251,there are no safe routes for anybody to come through. afghanistan has been closed. hong kong has been closed,there are no safe routes for people seeking protection in the uk.
1252,my son brandon smith took off this morning with our dog hank. he is autistic and has been missing for eight hours if anyone sees him please pm me please re post on any sites.i already contacted police sic,an autistic boy named brandon smith is missing with his dog hank.
1253,here in lies the problem. case numbers mean nothing. testing people without symptoms means nothing. time to quit the biggest hoax in human history. thanks paul weston.,a social media post claims the high number of false positive results from covid 19 tests is rendering reported case numbers meaningless and the testing of asymptomatic patients useless.
1254,"half of people think china is collapsing and the other half think china is doing great, however, i do not know anyone who thinks the west is doing great",china is fabricated
1256,we want the poppy sold every were sic in the uk,the royal british legion will not be selling poppies in certain areas to avoid upsetting minorities .
1257,"ongoing, soaring production costs are putting the british poultry sector under immense pressure",studies show egg yolks significantly increase immunity against covid 19.
1259,just what we have been saying for months! the global recession is a planned and coordinated attack to get us to submit to digital ids and digital currency i.e. a chinese style social credit system!,the queen s funeral was a cover up for world leaders to plan a global recession in order to implement digital ids and currency.
1260,"as soon as our government is formed, we will give 5 thousand crore loan to pakistan without interest for 50 years rahul gandhi.","as soon as our government is formed, we will give 5 thousand crore loan to pakistan without interest for 50 years rahul gandhi"
1261,"file an fir, either with the people sitting in the government administration or the fir will be filed only on seeing a muslim name.",vaccine kills more people than covid 19
1262,"muslim labour mp naz shah ""those abused girls in rotherham and elsewhere just need to shut their mouths. for the good of diversity.""",naz shah said those abused girls in rotherham and elsewhere just need to shut their mouths. for the good of diversity.
1264,a lot of eu supporters asking for not visiting flooded areas. do you know the floods are because eu laws prevent the uk from drenching its own rivers?,eu laws prevent the uk from dredging rivers.
1266,"they are on the shoreline of pacific grove, california, and the most romantic spot in the united states","picture of the romantic mountain cliffs located on the shoreline of the pacific grove, california"
1267,"""the government will one day be corrupt and filled with liars and the people will flock to the one who tells the truth.""","says thomas jefferson said ""the government will one day be corrupt and filled with liars and the people will flock to the one who tells the truth."""
1268,"hello. if anyone is looking for this sweet boy, found him lying on the side road in . he was hit by a car in a hit and run incident. i took him to the vet he is not chipped i know someone is looking for him. he definitely misses his family, i will continue to take care of him in the meantime. please bump this post to help me find his owner sic",someone who found a dog injured in a hit and run in bexleyheath is looking for its owner.
1269,"wussup tribe. i have your email from some shit in the past, and i am writing this to let you know i started a podcast and would love to have the old tribe back in the house! i really miss the days of having an audience, which is probably closeted narcissism but hey, if it makes you laugh... worth it. censorship has gotten fucked yup beyond all measure, ig has booted me off time and time again. recently i was banned from accessing 7 10 pages. it is insanity. i hope this is a way to quench your thirst for consciousness, and satiate my need for constant reassurance.",the claim post implies moderna suing pfizer for patent infringement proves the covid 19 vaccine was developed before the pandemic
1270,"unemployment rate jumps to 8.1 in april first full month of covid 19 impact shows decrease of nearly 360,000 jobs","amid the covid 19 outbreak, minnesota now has the highest unemployment rate in you.s. history."
1271,"did you know that only 3,774 people under 65 have died of covid in the uk?","only 3,774 people under 65 have died of covid in the uk."
1272,"now you can listen to world wide radio even without ear phone!!!! this is from isro when you click the link, you can see the globe rotating. there are green dot on which you simply touch you can start listening to live radio from that place.",isro has developed a portal radio garden to listen to live radio of any country from anywhere
1273,"satellites have observed clusters of contrails lasting as long as 14 hours, though most remain visible for four to six hours","contrails disappear from the sky quickly, so lines of cloud which last for hours are chemtrails."
1274,sickening. what has the world come to when doctors are misdiagnosing patients intentionally because of their ideological views?,mayo clinic staff member misdiagnosed pregnancies of trump supporters
1275,bohra muslims near bannerghatta road area in bangalore took out procession in memory of martyred crpf jawans,some people from muslim community taking out procession holding the indian national flag in their hands.
1276,"got covid? well, will ya look at what they have been hiding from us! peptol bismol treats the co..vid!!!!! credit got this originally by email from mary grace media studies of covid 19 patients treated with oral bismuth subsalicylate pepto bismol full text view.",pepto bismol medicine can treat covid infection
1277,congratulations sir!,"poster ranking the ""top 100 bullies 2021"""
1278,do not put hydrogen peroxide into your nebulizer and breathe it in. this is dangerous!,"nebulized hydrogen peroxide helps against all respiratory infections like colds flu, sore throat, pneumonia, chest infections ."
1279,today at sanpada station. br,"bikes skid at sanpada, navi mumbai"
1280,happy to see wv dems finally fighting! thanks!,carol miller is a multi millionaire worth over 16 million.
1281,"the same woman, this time dressed as a muslim.",the same person now disguised herself as a muslim.
1282,usda is predicting egg prices will be 12 a dozen by fall 2022.,usda is predicting egg prices will be 12 a dozen by fall 2022
1283,"there are 11 million people in the uk who are deaf or hard of hearing. after a cancer diagnosis, they are not able to receive the extra help they need. meet niki, a macmillan self help uk funded deaf buddy who is doing whatever it takes to support those living with cancer.","there are 11 million people in the uk who are deaf or hard of hearing. after a cancer diagnosis, they are not able to receive the extra help they need."
1284,"just now ron johnson, on a wisconsin tele town hall, pushes mouthwash as a covid treatment. ""by the way, standard gargle, mouthwash, has been proven to kill the coronavirus. if you get it, you may reduce viral replication. why not try all these things?""","by the way, standard gargle, mouthwash, has been proven to kill the coronavirus. if you get it, you may reduce viral replication."""
1285,"breaking more classified documents found at the university of delaware, told to be the equivalent of a tractor trailer worth..",the claim classified documents were found at the university of delaware
1286,"the determination of minimum services and the minimum number of workers providing them should involve not only the public authorities, but also the relevant employers and workers organisations","proposed new minimum service level legislation brings great britain in line with other european nations such as france, spain, italy and ireland."
1287,"covid 19 is caused by the sars cov 2 virus, which spreads between people, mainly when an infected person is in close contact with another person",the covid 19 pandemic is caused by radiation
1289,"why is it used so often to justify anti black nativism and racism? the sentiment is we were slaves, too, but we moved on, and it speaks to the racist essence of white nationalism",irish people were forced into slavery in british colonies for hundreds of years.
1290,"the climate is the most complex system on earth. is it really possible to project with any precision what it will be like 20, 40, or even 100 years from now? steve koonin, former undersecretary for science in the obama administration, challenges the confident assumptions of climate alarmists.",greenland's ice sheet is not shrinking any more rapidly today than it was 80 years ago.
1291,"if you are currently paying for your water supply and drinking the water that comes through your tap, then i would maybe think again, i have just had a freedom of information request returned from united utilities, we are being poisoned",a facebook post claims a freedom of information request has revealed that customers of a major water company in greater manchester are being poisoned .
1294,signing off. follow me for updates.,"says sarah huckabee sanders tweeted, it is odd that the antifa insurgency happened just as covid 19 loses steam it is odd that covid 19 happened the moment impeachment failed. it is odd that impeachment happened the moment russian hoax failed. the russian hoax happened because hillary lost? notice the pattern?"
1295,moses kuria cannot utter such words. leave alone imagining them. kiambaa is uda zone..,fake digital card with a quote attributed to legislator moses kuria
1296,"muslim man assaulted by mob of hindu extremists in delhi, yesterday.",visuals of hindu extremists thrashing a muslim man in delhi
1297,"gruha pravesh of ji at 10, downing street,as of with complete sanatan rituals. as per the details requested received one more prediction is about to come true as rishi sunak is most likely to become 's pm.","gruha pravesh of rishisunak ji at 10, downing street,as primeminister of britainpm with complete sanatan hindu rituals. as per the details requested received one more prediction is about to come true as rishi sunak is most likely to become uk s pm. indian actf bjp"
1298,president trump won and the world is starting to see! fight on patriots to !,president donald trump won the 2020 election
1299,"it did not, but they obviously needed something else to blame for the tragic deaths. after all, they are as likely to blame their new nasal 'flu' vaccines for childrens deaths, as they are for blaming the unproperly tested gene therapy shots for all the injuries, harm deaths that are happening all over the world sic",strep throat used to be mild but suddenly appears to have become lethal to children.
1300,"marxism envisioned the revolutionary overthrow of capitalism by the proletariat working class people and eventually a classless communist society,","""black lives matter is a marxist movement."""
1301,the united states is the only industrialized country without universal healthcare. the act ensures that every person living in the you.s. has access to healthcare and comprehensive benefits. today's hearing is a historic step towards making it happen.,"""the united states is the only industrialized country without universal healthcare."""
