PID,Social Media Post,Normalized Claim
1,"president ""biden's plan would mean america's seniors have no air conditioners during the summer.""","biden s energy plan would get rid of seniors air conditioning, heat and electricity"
2,"important announcement coronavirus last evening dining out with friends, one of their uncles, who is graduated with a master's degree and who worked in shenzhen hospital guangdong province, china sent him the following notes on coronavirus for guidance 1. if you have a runny nose and sputum, you have a common cold 2. coronavirus pneumonia is a dry cough with no runny nose. 3. this new virus is not heat resistant and will be killed by a temperature of just 26 27 degrees. it hates the sun. 4. if someone sneezes with it, it takes about 10 feet before it drops to the ground and is no longer airborne. 5. if it drops on a metal surface it will live for at least 12 hours so if you come into contact with any metal surface wash your hands as soon as you can with a bacterial soap. 6. on fabric it can survive for 6 12 hours. normal laundry detergent will kill it. 7. drinking warm water is effective for all viruses. try not to drink liquids with ice. 8. wash your hands frequently as the virus can only live on your hands for 5 10 minutes, but a lot can happen during that time you can rub your eyes, pick your nose unwittingly and so on. 9. you should also gargle as a prevention. a simple solution of salt in warm water will suffice. 10. cannot emphasise enough drink plenty of water! the symptoms 1. it will first infect the throat, so you will have a sore throat lasting 3 4 days 2. the virus then blends into a nasal fluid that enters the trachea and then the lungs, causing pneumonia. this takes about 5 6 days further. 3. with the pneumonia comes high fever and difficulty in breathing. 4. the nasal congestion is not like the normal kind. you feel like you are drowning. it is imperative you then seek immediate attention. spread the word please share.","if someone with the new coronavirus sneezes, it travels about 10 feet before it drops to the ground and is no longer airborne"
3,heart is delighted to hear,heart is delighted to hear
4,an allowed appeal is one where the initial refusal is overturned and the judge replaces the decision most commonly with a decision to grant a form of status,"the vast majority of people coming across the channel are economic migrants, they are not asylum seekers."
5,"warm water therapy dr. d. mensah asare says that the main benefits of warm water are numerous. a group of japanese doctors confirmed that warm water is 100 effective in resolving some health problems?, including headache, migraine, high blood pressure, low blood pressure, pain of joints, sudden increasing and decreasing of heartbeat, epilepsy, increasing level of cholesterol, cough, bodily discomfort, golu pain, asthma, hooping cough, blockage of veins, diseases related to uterus urine, stomach problems, poor appetite, also all related diseases to the eyes, ear throat. how to use warm water ? drink 4 glasses of warm water not above 100 degree centigrade temperature on empty stomach first thing in the morning and eat nothing until an hour later you may not be able to make 4 glasses at the beginning, but slowly you will. the warm water therapy will resolve these health issues within reasonable periods ? ? diabetes in 30 days ? blood pressure in 30 days ? stomach related issues in 10 days ? all types of cancer in 9 months ? blockage of veins in 6 months ? lack of hunger poor appetite? in 10 days ? uterus and related diseases in 10 days ? nose, ear throat problems in 10 days. ? women problems ? in 15 days, ? heart diseases in 30 days ? headache migraine in 3 days ? low blood pressure in 30 days. ? cholesterol in 4 months ? epilepsy and paralysis continously in 9 months ? asthma in 4 months. no doubt warm water on empty stomach every morning will help immensely in aiding digestion, eliminating constipation, alleviating pain, sheding excess fats, improving blood circulation, slowing down to a great measure premature aging etc",a widely popular social media post claims that drinking warm water will cure a long list of diseases. we fact checked and found that the claim is mostly false.
6,"in thane, thyrocare lab sealed by gov., because they gave fake covid positive reports to people. the reason behind this is this lab have connection with pvt. hospitals and after fake positive reports they send that person to that particular hospitals those have three lakhs rupees package for covid patient. false positives putting thane citizens at risk. please share so it can reach to max people",thyrocare labs are sealed in thane over false positive covid19 testing
7,meanwhile in kipsigis a covid patient was nearly buried alive. moh has really bungled this pandemic and the best thing they could all do is resign.,covid 19 victim was almost buried alive
8,"did you know? eating 2 onions daily helps increase immunity, treat depression, fight the common cold and flu being a potent natural antibiotic, and it helps you sleep better!",eating 2 slices of onions a day treat depression
9,"qanon promoters on telegram, including qanon john, are already speculating baselessly that the elementary school shooting in uvalde, texas, was a false flag.","the shooting at an elementary school in uvalde county, texas, was a false flag."
10,"in asia, where hundreds of millions of smallpox vaccinations were given from 1967 to 1972, aids remains rare. conversely, the us is experiencing a major aids epidemic. yet smallpox was eradicated there many years ago","according to the times in 1987, smallpox vaccines triggered the awakening of dormant hiv among recipients, causing the aids epidemic."
11,"if you have migraines just put a little bit under your tongue, within minutes you will feel your migraine easing up","if you have migraines just put a little bit under your tongue, within minutes you will feel your migraine easing up."
12,"there is a possibility that these common adverse reactions, that are not dangerous in fitter, younger patients and are not unusual with vaccines, may aggravate underlying disease in the elderly",23 people in norway died after getting the pfizer covid 19 vaccine.
13,"in honor of , i remind you that governor evers wanted to increase your taxes by 1 billion just for heating your homes. instead, republicans cut your taxes by more than 2 billion. we want to keep more money in your pockets.","says gov. tony evers ""wanted to increase your taxes by 1 billion just for heating your homes instead, republicans cut your taxes by more than 2 billion."""
14,bengali actor aindrila sharma passed away at the age of 24 in a private hospital in howrah today after suffering multiple cardiac arrests last night. another effect of covid vaccine! young people getting heart attacks! slowly people are dying due to vaccine!,bengali actor aindrila sharma die of the covid vaccine
15,"our study found that engaging in 7 h of mental work similar to that found in an office environment, with 10 min breaks every 50 min, can negatively impact cognitive efficiency, suppress brain neural network activity, and because mental fatigue. these effects do not fully recover after a 4.5 h rest","a study shows short breaks during a working day because mental exhaustion that affects a person s focus, as well as attention, learning and visual recognition."
16,,buzz aldrin admitted the moon landings were faked in an interview.
17,"thrilled that has granted fast track designation for our mrna based combo vaccine candidate for influenza and , expediting the review time so we hopefully can bring this potential","pfizer ceo albert bourla resigned, saying mrna vaccines are not safe."
18,two terrorists caught by police with courage and intelligence at dahod railway station. some people and employees of the railway administration were held hostage at gunpoint by the terrorists,two terrorists caught by police with courage and intelligence at dahod railway station. some people and employees of the railway administration were held hostage at gunpoint by the terrorists.
19,"working hard on the biggest tax cut in you.s. history. great support from so many sides. big winners will be the middle class, business jobs","says the gop plan he supports is ""the biggest tax cut in you.s. history."""
20,"flu season is coming up! many people every year, sometimes over 100,000, and despite the vaccine, die from the flu. are we going to close down our country? no, we have learned to live with it, just like we are learning to live with covid, in most populations far less lethal!!!","sometimes 100,000 people or more die from the seasonal flu"
21,"bank strike announced on 26th 27th september , 28th september is 4th saturday , 29th is sunday.. 30 th half yearly closing. oct 2 gandhi jayanthi holiday. plan accordingly",banks are closed continuously from 26th september 2019 to 30th september 2019.
22,420. fraud,"modi inaugurated the first phase of the ahmedabad metro project, which was already inaugurated in 2019."
23,"the facts do not lie. the 2021 letter you signed was obviously drafted by railroad industry lobbyists. it supports waivers that would reduce visual track inspections. now will you vote to help us toughen rail safety accountability and fines, or not?","""the 2021 letter marco rubio signed was obviously drafted by railroad industry lobbyists. it supports waivers that would reduce visual track inspections."
24,"new variant b.1.1.529 is named as stay at home from a doctors' group rsa the virus is back, this time with more energy, tactics and camouflage. we do not cough, no fever, it is joint pain, weakness, loss of appetite and covid pneumonia! of course, the death rate is higher, it takes less time to get to the extreme. sometimes no symptoms ... let us be careful ... the strain is not domiciled in our nasopharyngeal region! it directly affects the lungs, which means window periods are shortened. i have seen a number of patients without fever, but an x ray report shows moderate chest pneumonia! the nasal swab is often negative for covid19! there are more and more false pharyngeal nasal tests ... which means that the virus spreads directly to the lungs causing acute respiratory distress due to viral pneumonia! this explains why it has become acute and more fatal !!! be careful, avoid crowded places, wear a face mask, wash your hands often. wave more deadly than the first. so we have to be very careful and take every precaution. please become an alert communicator among friends and family ... do not keep this information to yourself, share it with your family and friends. please take care and stay safe !",the omicron variant cannot be detected by pcr test?
25,the unhcr is present in the region and they are the right mechanism by which people should apply if they do want to seek asylum in the united kingdom,people fleeing sudan for humanitarian reasons should apply through the unhcr if they want to seek asylum in the uk.
26,psa this is hypercapnia. it can be caused by rebreathing your own exhaled co2 by wearing a mask continuously!,"wearing a mask can cause hypercapnia, by making you breathe in too much carbon dioxide."
27,all the world's a stage,a police car destroyed during protests in bristol is a prop vehicle as the mot has expired.
28,"a study found that 2 hours of silence per day promotes cell development in the hippocampus region of the brain, where memories are found",fact check can remaining silent for a few hours per day promote cell growth in the human brain?
29,how can harris be the 1st black woman to run for vp? or person of color? meet charlotta bass.,charlotta bass was the first black woman to run for vice president
30,"liquor stores are open, strip malls can have 5 customers, but dentists are non essential?!",says gov tony evers administration deemed dentists non essential
31,pilot pissing in the cockpit of paf f 16 said urine increases efficiency of jets told by allah in his dream,pilot pissing in the cockpit of paf f 16 said urine increases efficiency of jets told by allah in his dream.
32,it is an herbal combination that helps to strengthen your gums and completely eliminate all of the stains from your teeth.,herbal teeth whitening foams strengthen gums
33,it is interesting to see the memorandum of the british government through which mr. gandhi became mahatma gandhi officially,it is interesting to see the memorandum of the british government through which mr. gandhi became mahatma gandhi officially.
34,the lady holding the in her hand is none other than.. the wife of subba reddy chairman of the world richest hindu temple tirupati dear hindu's.. wake up before it is too late,the lady holding the bible in her hand is none other than.. the wife of subba reddy chairman of the world richest hindu temple tirupati dear hindu s.. wake up before it is too late
35,"we have bought the moderna which protects you against both covid and flu, which is a good thing, so get that booster in place."" this isn",the moderna booster vaccine protects you against both covid 19 and flu.
36,updated uk government assessment for pfizer covid 19 vaccine,you.k. has revoked covid vaccine for pregnant women
37,"""the benefit of the vaccine in no way outweigh the risks."" denmark suspends covid vax program after study of 23 million people raises health alarms",denmark paused the covid vaccination program due to increased risk of myocarditis
38,"so you are going to receive a text message on your phone. if you do not reply to that text message, basically, the use of your phone is going to be limited so they are going to put your phone off for the day.",mobile phone networks are in breach of gdpr by providing your phone number to another agency to allow emergency alerts.
39,landslide victory in gujarat. scene from one of the strong rooms in that state bhavnagar constituency.,landslide victory in gujarat. scene from one of the strong rooms in that state bhavnagar constituency.
40,"this is the guy who added his infected blood to pepsi. for the next few weeks do not drink any products from pepsi, as a worker from the company has added his blood contaminated with hiv aids . brothers and sisters please this message to the people who you care",man shown in the picture has added his hiv infected blood to pepsi. do not consume pepsi for the next few weeks
41,the chinese balloon has been shot down after biden called the chinese president and asked for his permission to shoot it down.,biden asked china for permission to shoot down spy balloon
42,"unsurprisingly, the only two regimes to ever regulated stargazing have been the inquisition and",state forces citizens to pay for stargazing permit to view night sky in public parks
43,"this is a rohingya family. destitute on a road in delhi. together with 8 children, 3 wives, out of which 2 are also pregnant. in hand is samsung c7 pro mobile which costs only rs 29,000. the opposition is sad to see their condition, so keep paying taxes on time","this is a rohingya family. destitute on a road in delhi. together with 8 children, 3 wives, out of which 2 are also pregnant. in hand is samsung c7 pro mobile which costs only rs 29,000. the opposition is sad to see their condition"
44,"planned by then cm modi, inaugurated by pm modi, jamnagar junagarh highway bridge collapsed within 3 months of inauguration!",the collapsed jamnagar junagarh highway bridge was inaugurated by pm modi three months ago.
45,anything is possible with yogiraj. got a job for those who smoke ganja salary more than 80 lakhs.,anything is possible with yogiraj
46,japan's dressing room after costa rica match.,japan s dressing room after the costa rica match.
47,had this floating around my family whatsapp threads. looks like spam? getting trough family panic and anti china paranoia about coronavirus is proving hard enough as it is.,"coronavirus stays on fabric for 9 hours, so washing clothes or being exposed to the sun for two hours meets the purpose of killing it."
48,the plane of indonesia passengers has a narrow escape,indonesia
49,"if you are experiencing pregnancy complications and your doctor tells you that abortion is necessary, find a new doctor. you and your baby deserve better. abortion is never medically necessary to save the life of the mother.",abortions are never medically necessary
50,"amul 75th anniversary! click to enter to participate in the survey, have a chance to win 6000 rupee!","amul 75th anniversary! click to enter to participate in the survey, have a chance to win 6000 rupee!"
51,another in a series of lies spread by modi .. !!,pm narendra modi credited first metro service in the country to atal bihari vajpayee
52,"2020 peak active cases 9,034,460 vaccinated 0 2021 peak active cases 9,243,682 vaccinated 71 i hate to break this to you, but this not a ""pandemic of the unvaccinated.""","""peak active cases of covid 19 for 2020 vs. 2021 show this is not a pandemic of the unvaccinated.'"""
53,"we are going to celebrate our grand opening by doing something special for you. we will be rewarding someone who has shared then commented by february 13th with a 10 night stay for 2 people in a 4 all inclusive hotel. do not worry about flights and transfers, it is all included. you will have 2 years to use the holiday",people who share then comment on a facebook post will be given the chance to win a holiday.
54,bjp has won elections in gujarat and himachal pradesh through evm hacking ts krishnamurthy pre election commissioner,bjp has won elections in gujarat and himachal pradesh through evm hacking ts krishnamurthy pre election commissioner
55,aussie with the real talk,"in australia, a 17 increase in heart attack deaths in the first eight months of 2022 is linked to covid 19 vaccination."
56,"did you know? natural cures89 dandelion root is able to kill 98 of cancer cells within 48 hours. not only that, but it acts as a powerful anti inflammatory, immune booster, antioxidant and organ detoxifier",dandelion root is able to kill 98 of cancer cells within 48 hours.
57,atheist in in indian context is only a hindu non believer of his own hereditary faith but owing allegiance to other faiths. that too to christianity. pl be informed of this clarification,"pictures of south indian actor turned politician, prakash raj, have gone viral with a claim that he has become a christian. we found that the pictures were real but not from the same context that is shared in social media messages."
58,not sure if he is prophesying or planning? has anyone read the chapter that this passage belongs to?,"thousands in spain, israel and portugal have taken to the streets in protest against the effects of world economic forum globalism."
59,"hold off on the ""voting does not work"" doomers. voting did not work previously. now we are onto their schemes. i am going until the next election for president. i expect this one to be a haggard mess. if it does not get sorted out and accountability applied by the next one i will join you in your misery.",joe biden announced to the world tonight that they are going to cheat by dumping ballots.
60,"i think this study is very likely to be correct. i would see no reason to doubt it. more importantly, it is exactly what any immunologist would expect to be true",research from israel suggests that the pfizer vaccine is much less protective against covid 19 than natural immunity from catching the disease.
61,"hello my name is kane stewart. i was born here in , june 17 1973 looking for my birth mother or father. mother's name is cathy m evans and she was only 16 at time of my birth. that is all info i have. please help me reunite with my family by",a facebook user is searching for their birth mother or father.
62,really bad news! the baltimore house of elijah cummings was robbed. too bad!,"""elijah cummings house was broken into after trump publicly attacked him on twitter."""
63,"30 mins long but well worth a watch and just what we need , great work from this fella reporting a criminal offence committed by someone in public office",the vaccines contain polysorbate 80 and that is known to cause fertility issues.
64,this is great can post this to people that argue with me now. would be great if we can find the original link though,a poster from the mhra makes various claims about the vaccines and importance of yellow card reports.
65,"from 18th june saturday last week till august 2022 this year, it will be colder than previous years. they call it aphelion phenomenon starting from tomorrow 05.22 we will experience the aphelion phenomenon where the earth will be very far from the sun. we cannot see the phenomenon but we can feel its impact. this will last until august 2022, we will experience cold weather which will have an impact on flu, cough, shortness of breath etc.therefore, let us all increase immunity by drinking lots of vitamins or supplement so that our immunity will be strong.the distance from earth to sun is 5 light minutes of 90,000,000km the phenomenon of aphelion to 152,000,000 km 6.6 farther. protect your body from cold, wear warm cloths, drink vitamins supplements to boost your immunity.","several social media posts claim the aphelion phenomenon will increase earth s temperature till august. we fact checked and found the claim to be false. the aphelion phenomenon affects the duration of weather, not the intensity."
66,officers have been subjected to considerable levels of abuse and violence. one suffered a broken arm and another suffered broken ribs. both have been taken to hospital,police officers suffered broken bones at a bristol protest.
67,one in a hundred children will actually get sick enough with covid to be admitted to hospital,one in 100 children who catch covid 19 get sick enough with the disease to be admitted to hospital.
68,"gosh! okay... i, pete buttigieg, politician, do henceforth and forthwith declare, most affirmatively and indubitably, unto the ages, that i do favor medicare for all, as i do favor any measure that would help get all americans covered. now if you will excuse me, potholes await.","says that amazon ""is literally paying zero in taxes."""
69,re usps 1. usps has been losing billions for 14 straight years. 2. usps services have been adjusting to covid 19. 3. usps has enough liquidity to operate through mid 2021. 4. the problem with mail in voting right now is that state election standards do not match usps practices.,"says ben shapiro tweeted, the usps is not only a bloated and outdate government agency, it is also ineffective and incompetent. it is been 2 months since my wife went on a hawaii vacation with her personal trainer she said she would send me postcards every day and so far none of them have arrived."
70,"anti poison. there are many snakes with a very poisonous venom that kills within some hours if your a victim of snakes bites or poison, just look for a cashew tree, use your cutlass to get the bark of the cashew tree, and chew the bark of the tree as you chew, swallow the water, do not swallow the chaff. it will neutralize every poisonous substance from the snake even if it is an anaconda bite. very effective and powerful to destroy snake venoms. you can keep the bark for any emergency, even if it is a dry one, just soak it in water. it does not spoil, it can be kept for years god has blessed us with so many herbs but many do not know it.",eating cashew nut tree bark neutralize snake venom
71,"an ultimate solution to typhoid and a blood booster sometimes because you do not pay for these remedies or because i am not a medical doctor,you do not value the information,some great information's does not cost you a penny and it saves life's this is coconut peel, for typhoid or to boost your blood dry it very well with sun and cook it with a pinch of potash,drink a cup morning and night check yourself withing two weeks and see how typhoid will fly away the professor 2347045240525",coconut choir infused water can cure typhoid
72,there is a growing concern that a sars cov 2 related inflammatory syndrome is emerging in children in the uk,the nhs has issued a letter saying that some children infected with coronavirus have been exhibiting symptoms similar to toxic shock syndrome.
73,"thanks, joe!","joe biden said ""we cannot win this re election. we can only re elect donald trump."""
74,tree carving north kashmir dogripora.,tree carved in shape of hand is located in kashmir
75,"100 of covid deaths in canada now due to mrna vaccine, new data shows!",100 of covid 19 deaths in canada now due to mrna vaccine
76,"georgia voter id, 17 days of early voting. colorado voter id, 15 days of early voting. atlanta is 51 black. denver is 9.2 black. the is moving the out of atl which has more day of voting rights than co? the wokes are at it again, folks.","georgia ""has more day of voting rights than co."""
